{
  "offer_version": "1",
  "contract_offer_id": "selkey.mediation.v1.standard",
  "purpose_code": "MEDIATION",
  "schema_ref": "vcav_e_mediation_signal_v2",
  "policy_ref": "selkey.default.policy@active",
  "program_ref": "selkey.mediation.program@active",
  "allowed_model_profiles": [
    "api-claude-sonnet-v1",
    "api-gpt5-v1"
  ],
  "metadata_defaults": {
    "source": "selkey"
  }
}
